SPAM,NICE,MEAN,BOT,SUBSISTING,LOBBY CUSTOM WORDS,LOBBY CUSTOM ROUNDS,LOBBY DRAW TIME,LOBBY CUSTOM ONLY,PROVOKED
FOLLOW ME ON INSTAGRAM @HARRYPOTTER,COOL DRAWING!,wTF,I'M A BOT!! I CAN'T SHUT UP!!,LOL,Harry Potter,6,90,FALSE,stop
I'M HARRY POTTER AND YOU KNOW IT,good drawing!,trash drawing,I'M A BOT!! FUCK ME TOO!!!,HAHA,Ron Weasley,,,,stfu
I'M HARRY POTTERRRRRR,wow awesome,you suck,,haHA,Hermione Granger,,,,shut up
I HATE DRACO MALFOY,awesome drawing,idiot,,LMAO,Ginny Weasley,,,,fuck you
I LOVE GINNY WEASLEY,first class drawing!!!!!,uHHH,,lol,Voldemort,,,,fuck u
I'M HARRY POTTER AND MY WAND IS ELEVEN INCHES LONG!!!,NOOICE!!!,BAD DRAWING?!?,,LMFAO,POTTER BOT,,,,fuck u potter
I'M HAARRRY POTTER,,,,,Draco Malfoy,,,,fuck you potter
WATCH THIS AWESOME VIDEO OF ME TORTURING SNAPE!! https://youtu.be/Tx1XIm6q4r4,,,,,,,,,potter stupid
GINNY WEASLEY LOVES MY WAND!!!,,,,,,,,,stupid potter
GUESS WHO KILLED mOOLDY SHORTS??!?? ME! HARRY POTTTERRR!!!!,,,,,,,,,f u potter
I KILLED VOLDY VOLDY VOLDEMORT!!!,,,,,,,,,shut it
GINNY WEASLEY IS THE BEST!!!,,,,,,,,,
HARRRY POTTER IS THE BEST!!!,,,,,,,,,